{
  "intent": "feature",
  "profile": "template-single-host",
  "phase": "build",
  "layers": [
    "frontend",
    "backend",
    "data"
  ],
  "tags": [
    "auth",
    "data",
    "contract"
  ],
  "changed_artifacts": [
    "api-contract"
  ],
  "budget_tokens": 16000,
  "project_reserve_tokens": 3000
}
